{
  "edges": [
    {
      "data": null,
      "dst": "event:tel:0",
      "kind": "emitted",
      "src": "run:tel_events_steps_verify2"
    },
    {
      "data": null,
      "dst": "event:tel:1",
      "kind": "emitted",
      "src": "run:tel_events_steps_verify2"
    },
    {
      "data": null,
      "dst": "event:tel:2",
      "kind": "emitted",
      "src": "run:tel_events_steps_verify2"
    },
    {
      "data": null,
      "dst": "event:tel:3",
      "kind": "emitted",
      "src": "run:tel_events_steps_verify2"
    },
    {
      "data": null,
      "dst": "event:tel:4",
      "kind": "emitted",
      "src": "run:tel_events_steps_verify2"
    },
    {
      "data": null,
      "dst": "event:tel:5",
      "kind": "emitted",
      "src": "run:tel_events_steps_verify2"
    },
    {
      "data": null,
      "dst": "event:tel:6",
      "kind": "emitted",
      "src": "run:tel_events_steps_verify2"
    },
    {
      "data": null,
      "dst": "event:tel:7",
      "kind": "emitted",
      "src": "run:tel_events_steps_verify2"
    },
    {
      "data": null,
      "dst": "event:ucc:0",
      "kind": "emitted",
      "src": "run:tel_events_steps_verify2"
    },
    {
      "data": null,
      "dst": "event:ucc:1",
      "kind": "emitted",
      "src": "run:tel_events_steps_verify2"
    },
    {
      "data": null,
      "dst": "event:ucc:2",
      "kind": "emitted",
      "src": "run:tel_events_steps_verify2"
    },
    {
      "data": null,
      "dst": "event:ucc:3",
      "kind": "emitted",
      "src": "run:tel_events_steps_verify2"
    },
    {
      "data": null,
      "dst": "artifact:out/tel_events_steps_verify2/konomi_smoke_base/konomi_smoke_summary.json",
      "kind": "produced",
      "src": "run:tel_events_steps_verify2"
    },
    {
      "data": null,
      "dst": "artifact:out/tel_events_steps_verify2/perturbations.json",
      "kind": "produced",
      "src": "run:tel_events_steps_verify2"
    },
    {
      "data": null,
      "dst": "artifact:out/tel_events_steps_verify2/ucc_cov_out/audit_bundle.json",
      "kind": "produced",
      "src": "run:tel_events_steps_verify2"
    }
  ],
  "nodes": [
    {
      "data": {
        "path": "out/tel_events_steps_verify2/konomi_smoke_base/konomi_smoke_summary.json",
        "sha256": "336b4549831acee39054942f469ac63d530e7a3e964af6b62947ef5bc8645ea6"
      },
      "id": "artifact:out/tel_events_steps_verify2/konomi_smoke_base/konomi_smoke_summary.json",
      "kind": "artifact"
    },
    {
      "data": {
        "path": "out/tel_events_steps_verify2/perturbations.json",
        "sha256": "2722f530239f60e9e59c4b64f4a32454a68a30d1be373c9a7180fa1b459f1bf4"
      },
      "id": "artifact:out/tel_events_steps_verify2/perturbations.json",
      "kind": "artifact"
    },
    {
      "data": {
        "path": "out/tel_events_steps_verify2/ucc_cov_out/audit_bundle.json",
        "sha256": "d75bd35ffb27b3f9d925b3d83d993470829ba9c4c492feaa8fefca20d767d8af"
      },
      "id": "artifact:out/tel_events_steps_verify2/ucc_cov_out/audit_bundle.json",
      "kind": "artifact"
    },
    {
      "data": {
        "path": "C:/Users/pdxvo/Documents/Lean/CoherenceLattice/examples/submission_demo/runs/guided"
      },
      "id": "run:tel_events_steps_verify2",
      "kind": "run"
    },
    {
      "data": {
        "event": "step_start",
        "name": "konomi_smoke_base",
        "run_id": "tel_events_steps_verify2",
        "ts": "2026-01-12T17:45:38.588433+00:00"
      },
      "id": "event:tel:0",
      "kind": "tel_event"
    },
    {
      "data": {
        "duration_ms": 6900,
        "event": "step_end",
        "name": "konomi_smoke_base",
        "run_id": "tel_events_steps_verify2",
        "status": "ok",
        "ts": "2026-01-12T17:45:45.488937+00:00"
      },
      "id": "event:tel:1",
      "kind": "tel_event"
    },
    {
      "data": {
        "event": "step_start",
        "name": "ucc_cov_base",
        "run_id": "tel_events_steps_verify2",
        "ts": "2026-01-12T17:45:45.489935+00:00"
      },
      "id": "event:tel:2",
      "kind": "tel_event"
    },
    {
      "data": {
        "duration_ms": 950,
        "event": "step_end",
        "name": "ucc_cov_base",
        "run_id": "tel_events_steps_verify2",
        "status": "ok",
        "ts": "2026-01-12T17:45:46.440431+00:00"
      },
      "id": "event:tel:3",
      "kind": "tel_event"
    },
    {
      "data": {
        "event": "step_start",
        "name": "konomi_smoke_perturb_1",
        "run_id": "tel_events_steps_verify2",
        "ts": "2026-01-12T17:45:46.500550+00:00"
      },
      "id": "event:tel:4",
      "kind": "tel_event"
    },
    {
      "data": {
        "duration_ms": 8140,
        "event": "step_end",
        "name": "konomi_smoke_perturb_1",
        "run_id": "tel_events_steps_verify2",
        "status": "ok",
        "ts": "2026-01-12T17:45:54.641286+00:00"
      },
      "id": "event:tel:5",
      "kind": "tel_event"
    },
    {
      "data": {
        "event": "step_start",
        "name": "write_telemetry_json",
        "run_id": "tel_events_steps_verify2",
        "ts": "2026-01-12T17:45:55.038293+00:00"
      },
      "id": "event:tel:6",
      "kind": "tel_event"
    },
    {
      "data": {
        "duration_ms": 2,
        "event": "step_end",
        "name": "write_telemetry_json",
        "run_id": "tel_events_steps_verify2",
        "status": "ok",
        "ts": "2026-01-12T17:45:55.040294+00:00"
      },
      "id": "event:tel:7",
      "kind": "tel_event"
    },
    {
      "data": {
        "data": {
          "name": null
        },
        "kind": "ucc_run_module_start",
        "seq": 1
      },
      "id": "event:ucc:0",
      "kind": "ucc_event"
    },
    {
      "data": {
        "data": {
          "name": null,
          "ok": true
        },
        "kind": "ucc_run_module_end",
        "seq": 2
      },
      "id": "event:ucc:1",
      "kind": "ucc_event"
    },
    {
      "data": {
        "data": {
          "name": null
        },
        "kind": "ucc_run_module_start",
        "seq": 1
      },
      "id": "event:ucc:2",
      "kind": "ucc_event"
    },
    {
      "data": {
        "data": {
          "name": null,
          "ok": true
        },
        "kind": "ucc_run_module_end",
        "seq": 2
      },
      "id": "event:ucc:3",
      "kind": "ucc_event"
    }
  ],
  "run_id": "tel_events_steps_verify2",
  "schema": "epistemic_graph_v1"
}
